date,developerResponse,review,rating,isEdited,userName,title
2020-10-02 15:21:05,"{'id': 18251529, 'body': 'Thank you for providing this feedback. We will definitely share this with our team and we appreciate your help as we continue to improve our program!', 'modified': '2020-10-03T20:45:25Z'}",This used to be my favourite app at 5 stars. It is now less than 2 star and I have removed it. I accept that there will be adverts but the frequency and placement in this update renders the app completely useless. The paid for version is over the top expensive.,1,False,Caraline,They destroyed what was a great app
2019-07-16 07:16:00,,"So many food with same name but huge difference in calories. Can’t accurately record your intake. 
It can waste so much time find the right kJ in 
food",3,False,fanwei0039,2 star
2019-10-30 19:47:58,,"I used the app years ago, and it was very good.
Now it is just so full of adverts “go premium (subscription)” that is just annoying. 
I deleted it and found a much better one.",2,False,Hobohome,Too many adverts
2019-10-17 01:26:23,,"I paid for premium but the app is keep screwing up my log, I track my food, it doesn’t show on the app but decrease my macro and calories. And I have to delete and re download the app over and over again. Wasting my time and money",1,False,Ly-les,Screwed up my diet log
2019-05-16 01:31:27,,Changed my life for the better,5,False,Tickle berry 19890,Life changing app
2019-07-14 13:31:36,,Keeps asking to update my goals and then changing my calorie goal and current weight every time I sign in,2,False,Grashes,"Used to be better, seems to have a glitch now"
2019-06-08 21:06:11,,Occasionally crashes since the update,4,False,xblane,"Still good, still good"
2018-03-21 11:25:39,,"Outstanding app, could not manage my diet without this",5,False,rayjj50,Excellent
2019-03-01 09:24:46,,"I upgraded to premium version, however I do not have access to it on either the web or on the app.  Very frustrating as I have paid and not received anything or heard back about the problem.",1,False,tee_bax,Premium faulty
2019-01-31 23:14:52,,"The app is good but whenever I press on a blog for one of the meals, it always takes me to a different meal than the one I click
Using iPhone X with the latest software. 
Kind of annoying",2,False,jasonarena,Blog issues
2017-10-03 01:26:54,,"2 January 2017: Started using the MyFitnessPal iOS app. 
24 January 2017: Seems great so far. Food database is very useful.
June 2017: Travelled for 3 weeks but continued to use MyFitnessPal to count calories/kilojoules. 
30 September 2017: Achieved my target weight of 73kgs/161lbs. Lost 26kgs/57lbs using MyFitnessPal since January 2. 

I highly recommend the MyFitnessPal app.",5,False,treadersaust,Very useful
2017-11-11 08:06:49,,"I used to love MFP, using it daily. But since the iOS 11 update, it has been frustratingly buggy. Now I hate using it, but don’t have anything like it that I can use in Australia, so I’m stuck waiting for it to catch up",2,False,Yo Mumma so Fat,WAS a good app
2024-02-16 06:11:42,"{'id': 42087184, 'body': ""We're thrilled to hear that our MyFitnessPal app has been instrumental in your health and wellness journey. Keep up the great work!"", 'modified': '2024-02-20T17:26:46Z'}",My Fitness Pal allows me to manage my heath fitness and diet easily. Just love it.,5,False,Folly fitness,I really love My Fitness Pal
2017-09-14 03:58:58,,"Works well once you've established your regular diet, helps you to be disciplined with portion control! The secret of weight loss.",4,False,Johnny Sharpe,Very helpful
2024-06-01 01:41:15,"{'id': 44349417, 'body': 'Our apologies for any problems you are having. For additional support please visit: https://myfitnesspal.zendesk.com/hc/en-us/requests/new or send an email to support@myfitnesspal.com.', 'modified': '2024-06-03T20:08:48Z'}","Slow - just a plan to navigate and use, good luck updating ya meals or recipes in the add food loop, paid is likely better naturally but I doubt it’s good enough",3,False,noone now,Overhyped
2023-10-10 10:47:46,"{'id': 39460431, 'body': 'Thank you so much for letting us know! We are glad to hear this. We wish you all the success in reaching and maintaining all of your diet and fitness goals.', 'modified': '2023-10-11T17:01:43Z'}","Great app for calorie tracking-  comprehensive food list, protein, carb, fat breakdown….",5,False,jilkino,Calorie Tracking
2023-10-31 07:03:05,"{'id': 39876742, 'body': 'Our apologies for any problems you are having. We believe this issue should now be fixed. If you are still experiencing this problem, can you please follow the link https://myfitnesspal.zendesk.com/hc/en-us/requests/new or send an email to support@myfitnesspal.com for further help? Thanks.', 'modified': '2023-11-01T19:43:04Z'}",Can’t even open the app to use it. I uninstalled many times restarted phone etc nothing works it keeps force closing while trying to open,1,False,Mac Sealem,Force closes
2023-06-19 10:10:56,"{'id': 37237476, 'body': 'We are thrilled to hear you have been having success with the MyFitnessPal app. We wish you a lifetime of health and happiness!', 'modified': '2023-06-20T21:03:23Z'}",That’s the right app to track your macros and calories!,5,False,Williams Braga,Great app
2022-04-09 11:25:26,"{'id': 29178051, 'body': 'Thank you for sharing your feedback! Please contact https://myfitnesspal.zendesk.com/hc/en-us or support@myfitnesspal.com so we can hear more.', 'modified': '2022-04-14T17:43:38Z'}","please bring back multi add - the plus signs are so confusing and there are so many errors. also, when searching, can you please make the top portion of the page static so it’s easy to scroll through the list of foods because the whole thing moving gives me a headache. 😭",3,False,lastdigits,stop changing it!
2022-12-09 07:43:45,"{'id': 33679350, 'body': 'Our apologies for any problems you are having with your Fitbit connection. For additional support please visit: https://myfitnesspal.zendesk.com/hc/en-us/requests/new or send an email to support@myfitnesspal.com.', 'modified': '2022-12-12T15:12:37Z'}",Won’t sync with fitbit! I have to un-link then re link not worth the effort as it doesn’t back track previous days. Why would I pay over $100 for an app that only half works,1,False,Denzzii,App won’t sync
2022-08-26 01:20:46,"{'id': 31725102, 'body': 'Thanks for taking the time to leave feedback. Here are a few more details about the change to Barcode Scan - **https://rebrand.ly/barcode22**', 'modified': '2022-08-29T16:12:35Z'}","First, full page ads and now barcode scanning is behind a pay wall? I’ve used this app for many years but this greedy decision is the last straw. Don’t bother - try lifesum or macrofactor",1,False,Jack84306,Greed has ruined this app
2022-07-29 02:29:38,"{'id': 31209685, 'body': 'Our apologies for any problems you are having. For additional support please visit: https://myfitnesspal.zendesk.com/hc/en-us/requests/new or send an email to support@myfitnesspal.com.', 'modified': '2022-08-01T11:59:58Z'}",This app would be 5 stars but they have ruined by ads full screen which take quite long before you can even dismiss. I will be looking for an alternative app.,1,False,safwmoon,Ruined a good app with ads
2022-06-28 21:58:08,"{'id': 30640942, 'body': ""Sorry to hear you're not enjoying the new update. You can find Progress directly by scrolling down on the Dashboard on the main homepage, then tap the + button to enter your weight. Please see: https://support.myfitnesspal.com/hc/en-us/articles/5217312657293-New-Dashboard-FAQ#h_01G1RS830PY6C2CPHWM8G886VS"", 'modified': '2022-06-30T11:42:02Z'}","It’s now so difficult to do anything. I’ve been trying to weigh in for 10 minutes. If it’s easier to track things with pen and paper, what’s the point of mfp?",1,False,ScottIsMyNickname,Current design makes no sense
2021-11-12 19:20:32,"{'id': 26259634, 'body': 'Our apologies for any problems you are having. For additional support please visit: https://myfitnesspal.zendesk.com/hc/en-us/requests/new or send an email to support@myfitnesspal.com.', 'modified': '2021-11-14T22:06:55Z'}",Used to work so well but then after I updated my premium account stopped reflecting on the app. Mfp support team can’t even help to fix it,2,False,nmlou,Don’t update!
2019-08-22 04:43:44,,Current version drains battery at a terrifying rate. Needs fixing,5,False,czosmaty,Drains battery
2021-01-28 20:36:00,,I have been using this app for years.  Would love to see BMI.  And have measurements section to enter monthly.,4,False,TeeFeeBee,Great app could include
2020-12-26 07:08:35,"{'id': 20043394, 'body': 'Our apologies for any problems you are having. For additional support please visit: https://myfitnesspal.zendesk.com/hc/en-us/requests/new or send us an email to support@myfitnesspal.com.', 'modified': '2020-12-28T17:06:18Z'}",I’ve been trying to use this app for a YEAR now. Every time I try to log on with my created user I get either “we can’t process you resignation right now” or “this user doesn’t exist”. I’m so frustrated and upset at this failure of a consistent log in system.,1,False,Charli E. M.,NEVER BEEN ABLE TO EVEN USE THIS APP
2020-12-05 06:24:43,"{'id': 19594426, 'body': 'We are truly sorry for any issues you are having with the app. If you could please visit: https://myfitnesspal.zendesk.com/hc/ or send us an email to support@myfitnesspal.com for further help. If need be, you can always access the program via our main site at www.myfitnesspal.com.', 'modified': '2020-12-07T14:55:12Z'}",Have had this for a while but not used it recently. Went to log on and it’s a nightmare. Change password and still can’t get in. I will only try so many more times before I delete it. Not happy at all. 👎,1,False,Lorry1264,Not happy
2019-08-29 12:00:08,,"The latest update looks like trash. It’s like going from a fancy new update back to the very first version on the very first iPhone. Fire whoever gave the graphics the go ahead, it’s ugly",2,False,Dhdjebskdubbdjdjh,"Great app, except the latest update"
2024-08-28 01:06:30,"{'id': 46357992, 'body': ""Thank you for taking the time to share your positive experience with us. We're thrilled to hear that you're finding success with our app! If you ever have any questions or feedback, feel free to reach out at support@myfitnesspal.com - we're here to help!"", 'modified': '2024-08-29T18:34:16Z'}",Amazing help love the features,5,False,hamza aly khan,Thank you
2024-09-09 17:54:12,"{'id': 46666651, 'body': 'Our apologies for any problems you are having. For additional support please visit: https://myfitnesspal.zendesk.com/hc/en-us/requests/new or send an email to support@myfitnesspal.com.', 'modified': '2024-09-11T17:11:49Z'}","App used to sync with Apple Health app for all exercise, including historical workouts and steps
Now it is a pain, you have to manually sync or enter constantly",2,False,CT992343,Not syncing anymore
2024-09-03 23:20:32,"{'id': 46550639, 'body': 'We understand ads can be an annoying part of using free apps. MyFitnessPal hasn’t always had to show so many ads, especially full-screen ones. Unfortunately, the ad landscape has changed, making it harder to earn the revenue necessary to maintain and improve the app. Hope this helps, but feel free to contact us at support@myfitnesspal.com for more.', 'modified': '2024-09-06T16:52:28Z'}","Handy app that adds stealth advertising, has many features and food categories however lots of annoying ads popping up so only good for short term use",1,False,MelbCyclist!,Handy app that adds stealth advertising
2024-05-06 10:20:14,"{'id': 43762964, 'body': ""We appreciate your positive review! We are so happy to hear you're enjoying the app. If you have any questions or need assistance in the future, feel free to email us at support@myfitnesspal.com. Wishing you continued success on your health and wellness journey!"", 'modified': '2024-05-07T18:48:38Z'}",Best app to track calories,5,False,Andrea32451,Best app to track calories
2024-03-26 21:59:44,"{'id': 42896534, 'body': ""We're thrilled to hear that our MyFitnessPal app has been instrumental in your health and wellness journey. Keep up the great work!"", 'modified': '2024-03-28T15:24:01Z'}",Keeps me accountable and very easy to use,5,False,Ash00401,Love my fitness pal
2024-04-16 08:03:33,"{'id': 43332176, 'body': 'It sounds like you may be encountering a new bug. To help our team further investigate this, we kindly ask that you write into us directly at support@myfitnesspal.com. We greatly appreciate any further context you can provide!', 'modified': '2024-04-17T16:13:32Z'}",This app keeps logging me out several times a day! It’s driving me nuts and it’s missing some basic features available on other free calorie counter apps. I guess it’s time to move on.,1,False,KenOng07,Time to move on!
2022-10-09 23:19:45,"{'id': 32513941, 'body': 'Hello! Thank you so much for letting us know! We are glad to hear this. We wish you all the success in reaching and maintaining all of your diet and fitness goals.', 'modified': '2022-10-11T15:21:01Z'}",Love it. Has helped me lose weight and then maintain my goal weight.,5,False,Polynesian King,Polynesian King
2024-03-11 11:35:15,"{'id': 42566089, 'body': 'Thank you for this suggestion to add default serving sizes. Our team will definitely consider this for a future update! In the meantime, please see https://myfitnesspal.zendesk.com/hc/en-us/articles/360032272852-The-serving-size-I-need-to-log-is-not-available for more information on how to change serving sizes.', 'modified': '2024-03-13T15:05:33Z'}",Great app! Only thing I would recommend is having more choices for the serving size. E.g. 1/5 & 1/6.,4,False,FitKat1404,Review of Fitness Pal
2023-10-30 22:11:52,"{'id': 39873540, 'body': 'Our apologies for any problems you are having. We believe this issue should now be fixed. If you are still experiencing this problem, can you please follow the link https://myfitnesspal.zendesk.com/hc/en-us/requests/new or send an email to support@myfitnesspal.com for further help? Thanks.', 'modified': '2023-11-01T15:30:31Z'}",3rd day using. It won’t open. It just crashes on the phone.,3,False,Jimmyisgood,App crashes
2022-11-03 04:28:45,"{'id': 32976979, 'body': 'Hello! Thanks for your feedback. We understand your frustration. But, like most free apps, ads make it possible to keep our app up and running (and available for free). It’s how we pay our passionate employees, who work hard to research, plan, and build new features while supporting a community of over 200 million members. For further assistance, please email us at support@myfitnesspal.com.', 'modified': '2022-11-04T14:59:11Z'}","Free used to be bearable, with this new interface and ads in the middle, it’s very trash and premium is very expensive. There needs to be a budget subscription with no ads.",1,False,Aarent,New interface with tons of ads
2022-08-30 23:06:00,"{'id': 31793328, 'body': 'Thank you for your review of MyFitnessPal, we are happy to hear you are enjoying the program! If you ever need support from our team, please visit: https://myfitnesspal.zendesk.com/hc/en-us or send us an email to support@myfitnesspal.com.', 'modified': '2022-09-01T19:03:48Z'}","I have become dependent on this app, I love it so much, lost 10kg so far ❤️",5,False,possumonthemove,In love
2021-03-11 07:51:44,,"I absolutely love mfp I absolutely track every gram that goes in my mouth, it’s so easy, I’ve lost 5.6kg",5,False,dollythedoll,Mfp
2022-08-25 09:02:33,"{'id': 31682311, 'body': 'We appreciate you taking time to post a review, though we’re sorry about your frustration. If you have questions or want more detail, here’s a blog post that may help** -** **https://rebrand.ly/barcode22**', 'modified': '2022-08-26T17:16:21Z'}",I’m a MyFitnessPal user of 10+ years. Just heard you’re removing the barcode scanner for free users. What a nice way to reward your loyal supporters. I’ll be deleting the app and my account if this happens,1,False,eighty6girl,Making us pay for free features
2019-11-19 23:17:21,,Even just using the free version you can maintain a great diary and track your eating goals for keto,5,False,Janemitc,Great for keto diet
2019-05-05 08:19:59,,"Really, it is a terrific app. I use it everyday. Almost up to a 200 day streak. It’s helped me lose 20kgs.",5,False,Jesse loves you,Terrific
2018-02-16 21:00:09,,Excellent app good for tracking your steps to get on the right track,5,False,Butterfly_61,Butterfly 61
2018-11-15 09:36:13,,"Latest update is causing exercise recorded on Harmon devices to replicate through the day. Bit frustrating. 
Fix this. Great app",3,False,Moonshadow 82,Latest update - bugs
2018-08-10 08:24:22,,After the upgrade my app now constantly freezes and I can’t even get a meals worth of food entered before it freezes let alone log for a day!! Very frustrating please fix!!,1,False,Megsy-H-1987,Constantly freezing can not enter food!
2018-02-12 02:29:55,,"Easy to use, great scanner to record food labels, excellent in tracking eating habits..",5,False,alwaysbrokenomore,New me!
2017-12-02 17:56:21,,Very accurate and easy to use. Works well with iPhone 8,5,False,cschneider77,Great App
2017-11-04 05:35:06,,It’s a great app I am finding it easier to track my food.,5,False,Fay Nebe,Awesome
2024-06-13 22:57:18,"{'id': 44658304, 'body': ""We're thrilled to hear that you find MyFitnessPal helpful! Your positive rating means a lot to us. Happy tracking!"", 'modified': '2024-06-17T17:19:24Z'}",Easy to use and great for tracking weight and health.,5,False,Bertie D,Great tool for health
2017-11-01 20:28:27,,"Banner ads are okay. Pop up “win an iPhone 7” ads, that beep and appear every time you touch the screen, are not. Not paying $15/month for premium either, so uninstalled.",1,False,little_rose29,Ads were fine until recently.
2024-08-13 04:04:22,"{'id': 45996712, 'body': 'Our apologies for any problems you are having. For additional support please visit: https://myfitnesspal.zendesk.com/hc/en-us/requests/new or send an email to support@myfitnesspal.com.', 'modified': '2024-08-14T18:25:20Z'}","For an App that’s mainly used for calorie tracking it has bugs issues make tracking hard, when editing recipe save button is unresponsive and time waster",1,False,Aj33m,Issue
2024-05-28 23:32:47,"{'id': 44271096, 'body': ""Thank you so much for your 5-star review. We are always striving to enhance the user experience, so our team is happy to hear you're enjoying the MyFitnessPal app. Thank you!"", 'modified': '2024-05-30T17:04:23Z'}",Love this app,5,False,psroft,Use this every day. So convenient
2024-03-24 07:41:37,"{'id': 42514731, 'body': 'Thank you so much for letting us know! We are glad to hear this. We wish you all the success in reaching and maintaining all of your diet and fitness goals.', 'modified': '2024-03-11T16:59:36Z'}",Absolutely fantastic and so easy to use.,5,True,The kiwiaussi,My fitness Pal app
2024-03-28 08:37:04,"{'id': 42971306, 'body': ""Thank you so much for your 5-star review! We're thrilled to hear that you're enjoying the MyFitnessPal app. If you have any questions or need assistance with anything, please don't hesitate to reach out by emailing support@myfitnesspal.com. Keep up the great work!"", 'modified': '2024-04-01T15:59:51Z'}",Keeping me on track that’s important.,4,False,KazzaO,Healthy start
2024-03-17 08:38:47,"{'id': 42689968, 'body': ""We're so happy to hear that you find our app helpful in your health and fitness journey. We pride ourselves on providing a comprehensive database of foods, so you can accomplish your goals. If you have any suggestions or need further assistance, please don't hesitate to let us know by emailing support@myfitnesspal.com. Keep up the great work!"", 'modified': '2024-03-19T15:51:28Z'}",Great app to monitor my food intake and exercise.  What I’m eating and when.,5,False,Bml2052,Great tool
2024-03-19 00:37:04,"{'id': 42718626, 'body': 'Thank you for your review, and for supporting MyFitnessPal - we truly appreciate it! If you ever need help or want to provide any more feedback/suggestions, please email our team at support@myfitnesspal.com.', 'modified': '2024-03-20T19:56:57Z'}",My only complaint is Australian foods are a little under represented,3,False,Jtiern,Good way to keep yourself in check
2023-08-01 03:33:02,"{'id': 38058648, 'body': 'Thank you so much for letting us know! We are glad to hear this. We wish you all the success in reaching and maintaining all of your diet and fitness goals.', 'modified': '2023-08-02T20:24:24Z'}",Love this app. Great for tracking calories easily.,5,False,Big bax!!,Great App for calorie tracking
2024-02-18 23:08:43,"{'id': 42113243, 'body': 'Thank you for your review of MyFitnessPal, we are happy to hear you are enjoying the program! If you ever need support from our team, please visit: https://myfitnesspal.zendesk.com/hc/en-us or send us an email to support@myfitnesspal.com.', 'modified': '2024-02-21T16:06:26Z'}",Have enjoyed using the app and keeps me conscious of what I’m eating and drinking.,4,False,Richjones86,Keeps you accountable
2024-01-21 01:12:35,"{'id': 41459315, 'body': 'We are sorry to hear you are not enjoying the current free experience, but we have passed along this feedback to the appropriate team. If we can help with anything else or want to provide additional suggestions/context, please email us at support@myfitnesspal.com.', 'modified': '2024-01-22T19:01:36Z'}",Not that good unless you have premium,4,False,Tackytaco21,Rating
2023-09-23 07:28:04,"{'id': 39131720, 'body': 'Thank you for your review, and for supporting MyFitnessPal. We truly appreciate your review. If you ever need help or want to provide feedback/suggestions, please email our team at support@myfitnesspal.com.', 'modified': '2023-09-25T17:20:14Z'}",Excellent app! Would highly recommend.,4,False,JoeyJoeJoe1985,Five stars!
2023-08-16 22:21:12,"{'id': 38385437, 'body': 'Our apologies for any problems you are having with your Premium subscription. For additional support please send an email to support@myfitnesspal.com. Thank you!', 'modified': '2023-08-18T14:58:28Z'}",I have paid for a whole year for a premium subscription and i’ve only been allowed to use it for half that. this app is a scam and no way to contact anyone about it. save your money,1,False,Jattenoux,Scam
2023-05-26 14:44:19,"{'id': 36820459, 'body': 'Thank you for your inquiry, for additional support please visit: https://myfitnesspal.zendesk.com/hc/en-us/requests/new or send an email to support@myfitnesspal.com.', 'modified': '2023-05-30T14:28:26Z'}","This app is good but I can’t sync Strava with the app for some reason.

Can someone please reply and help x",4,False,Bolqq,Syncing Issue
2022-09-18 00:47:57,"{'id': 32104859, 'body': 'Hello! Thank you so much for letting us know! We are glad to hear this. We wish you all the success in reaching and maintaining all of your diet and fitness goals.', 'modified': '2022-09-19T15:19:53Z'}",Great way to focus and stay committed to losing weight.,5,False,yvybuhuvivvu,Very happy
2023-04-26 03:21:01,"{'id': 36208955, 'body': 'Our apologies for any problems you are having. For additional support please visit: https://myfitnesspal.zendesk.com/hc/en-us/requests/new or send an email to support@myfitnesspal.com.', 'modified': '2023-04-27T16:02:05Z'}","Sometimes the app doesn’t work and i search any food up, it says no results",2,False,faye sard,Good app but sometimes i can’t search up food
2023-04-01 00:06:41,"{'id': 35748746, 'body': 'We appreciate the feedback about Barcode Scan, but are sorry you’re disappointed. Just a reminder that you can still log any food with a database search—and previously scanned foods can be logged from your history. Here’s how: https://bit.ly/3fYl5vj', 'modified': '2023-04-03T18:16:57Z'}","Now you have to pay to barcode scan?? Are you serious!? 
This is app is becoming a joke. 
You get hacked, lose people’s sensitive data and expect us to give you money. 
I don’t think so.",1,False,Lma009,What a joke.
2022-02-25 14:32:42,"{'id': 28303524, 'body': 'Thank you so much for letting us know! We are glad to hear this. We wish you all the success in reaching and maintaining all of your diet and fitness goals.', 'modified': '2022-02-28T20:49:53Z'}",What a fantastic app. Such a great way to record your progress.,5,False,salvohead,Great app
2022-08-26 07:02:38,"{'id': 31725049, 'body': 'Thanks for taking the time to leave feedback. Here are a few more details about the change to Barcode Scan - **https://rebrand.ly/barcode22**', 'modified': '2022-08-29T16:10:54Z'}","You heard me developers, keeping the barcodes for ppl who wanna pay huh? we will see about that, as soon you remove that feature for free users, i will delete you and use another app who respects broke users like me.",1,False,UserAnon1999,I WILL DELETE THIS APP!!
2022-08-24 20:50:58,"{'id': 31679165, 'body': 'Thanks for your feedback. Moving a feature to Premium is never an easy decision, and we understand your disappointment. Here’s some more info if you’re interested **-** **https://rebrand.ly/barcode22**', 'modified': '2022-08-26T13:37:58Z'}",Used to love this app but not you have to pay $20 a month for premium just to scan your barcodes. Would have been happy to join a reasonable subscription but that’s a joke,1,False,rrfrog219,Overpriced
2022-06-25 21:15:46,"{'id': 30600753, 'body': 'Our apologies for any problems you are having. For additional support please visit: https://myfitnesspal.zendesk.com/hc/en-us/requests/new or send an email to support@myfitnesspal.com.', 'modified': '2022-06-28T12:14:49Z'}","I have paid for 12 months premium but the app will not update so I can use it. Very frustrating and no way of talking with someone to resolve the issue, no reply from support.",1,False,PremiumFail,Premium Doesn’t Work
