date,developerResponse,review,rating,isEdited,userName,title
2022-04-27 22:41:12,"{'id': 29511940, 'body': 'Our apologies for any problems you are having. Can you please send us an email to support@myfitnesspal.com for further help? Thanks!', 'modified': '2022-05-02T13:33:02Z'}","I set my macronutrient goals which is great to follow. Hitting my targets within 1-2g variance daily. Only I’ve just realised when I actually click on my carbs for the day I’m not really 1-2g of variance the soo glitches and adjusts my goals so when I think I’m 1g out from my 270 carb target because the app says I am. When clicking into carbs I’m actually 8g over my carb target for the day because the app has changed it for the day. Completely frustrating considering it has threw off all my targets for the week.
UPDATE: I have managed to switch off the setting that automatically adjusts the goals based off your  exercise and daily steps. Problem solved! For anyone else with the same issue go into more-> goals-> scroll to the bottom and click exercise calories -> turn off adjust my calorie goal. 

Changing review to 5 stars",5,False,annoyed0000,Issue with automatically adjusting daily macro goals.
2022-12-05 06:42:10,"{'id': 33572596, 'body': ""Our apologies for any issues you've come across. Please see https://myfitnesspal.zendesk.com/hc/en-us/articles/360032622691-Some-food-information-in-the-database-is-inaccurate.-Can-I-edit-it for more information. Can you please send us an email to https://myfitnesspal.zendesk.com/hc/en-us/requests/new for further help on the other things addressed?"", 'modified': '2022-12-06T18:19:01Z'}","Aside from some inter-app syncing issues (which can usually be fixed without much effort) this is a solid app. Definitely made calorie tracking easy and help me to lose a bunch of weight. My main annoyances are that little consideration has been given to those of us outside the US. The nutritional information on our food is different, and aside from letting us dig through the settings to switch back and forth between cal and kj (why can’t we just toggle between these in the info entry fields?) there are some annoyances when it comes to manually adding new items. For example, if the exact amount of certain nutrients is listed on the packaging, but MFP only accepts % of DI, I have to calculate that before I can add it. Certain nutrients and vitamins there isn’t even an option to add. Etc etc. Also the search function is a bit funky, often it gives too results that are barely similar to what I type, when there are almost identical (or completely identical) results buried way down the list. There’s also no way to correct foods that have incorrect serving sizes. If someone’s added wrong info for that barcode, good luck, you’ll have to make a custom meal and search for it every time. For no good reason other than they don’t care.

I also love how the my gradually remove basic features from the free tier over time instead of fixing the broken features which would compel one to pay for it in the first place.",2,False,dooblyboobly,Almost Very Good
2019-02-15 21:22:20,,"I’ve used MyFitnessPal on and off for several years, both the free and premium version. The only features I used from premium was the “time stamp” and “no ads”.  I’ve reverted back to the free version, because it has everything I need. 

The barcode scanner is great, and if the product isn’t there - you can add it. (Please include everything on the nutritional panel, guys) One thing that would help is if people would check their spelling when adding products to the lists, as these become available to us all and can make searching difficult. 

Absolutely love the recipe and meal features. You can add a favourite family recipe - and it will calculate how many calories per serving. I recommend keeping it to weight/per gram, so you can weigh your portion and get the true caloric value. 

In hindsight, it seems that the best way to get results it is to track your planned food BEFORE you eat. There are some sneaky calories out there!

I’ve recommended the app to several people, I like the diary sharing option (with password) which can help with accountability and partnering on your health journey. 

It can be used in conjunction with many fitness trackers and exercise apps. 

All in all, it’s definitely a worthwhile app to use - both free and premium versions. Give it a go, you won’t regret it.",5,False,DeniseJoy2019,Great app - Definitely get this one!!!
2024-01-08 00:34:44,"{'id': 41182775, 'body': ""We're so happy to hear that you find our app helpful in your health and wellness journey. We pride ourselves on providing a comprehensive database of foods, so you can accomplish your goals. If you have any suggestions or need further assistance, please don't hesitate to let us know by emailing support@myfitnesspal.com. Keep up the great work!"", 'modified': '2024-01-09T16:39:33Z'}","Honestly apps like these where its to keep in track never work for me because that motivation lasted 3 days lol but get yourself a body scale and start a diet that YOU CAN HANDLE!!! And this app is nice. Im for real taking this diet seriously not bc of the app because I can genuinely see the results in the scale, don’t trust your eyes only you all. Unlike ur eyes, the scale tells you the truth and only the truth 😂 so yes not the app but scale, but the app is a nice plus because my diet includes decreasing portion size so this is very nice, and it tells you how many carbs, protein and fat and even more with saturated fats and healthy fats. I’ve learnt a lot and still learning. Thanks app, I’ve been using it for about a week and lost 2kg, on the road to 3kg! (Dont worry I’m losing it healthy, eating all my vegetables and fruits just limiting carbs like bread, milk, obviously junk food too)",5,False,uyubun,I love you fitnesspal
2018-10-06 22:33:32,,"I’ve used this app (the free version) for years now to track macros. It’s been a fantastic tool, has a huge variety of foods in its data base. Is easy to scan and add foods and supplements and I love you can see into your friends food diaries for inspiration meals, ideas and motivation. My only wish is that it would have the option to add or track NET CARBS along with total carbs. I know that this would help a much broader variety of healthy lifestyles who focus on net carbs in there diet. I for one am looking at changing my nutrition to focus on net carbs and unfortunately I think I will be forced to look for another app. Please consider including this in your next update!! MFP is really my preferred go to for tracking and if this was available I would more than likely go premium as it does everything else I want!",5,False,Abcd BFG,Fantastic app- though i would love one extra!
2023-05-11 05:04:39,"{'id': 36489618, 'body': 'Our apologies for any problems you are having with creating recipes, or tracking weight loss. For additional support please visit: https://myfitnesspal.zendesk.com/hc/en-us/requests/new or send an email to support@myfitnesspal.com.', 'modified': '2023-05-12T16:23:07Z'}","I trialled the premium service of this app and cancelled (through the app) before the billing date but for some reason cancelling through the app doesn’t actually work and you need to go to your Apple Store to cancel it…I can honestly say it’s not worth the $130 AUD that it costs and never intended in making the investment but here we are.  

Often when you try to add a new recipe and doesn’t add and you waste your time scanning all ingredients and amending food quantities just for it to not save.  It happens so often that I thought it was a premium service, hence me trialling premium, but it still happens. 

There is also no way to track your weight loss and keep the same macro split/calories - you have to go and do it again if you change your weight.  I get that when you loose weight you should be amending these things, but not when you loose small amounts of weight and track it weekly.",3,False,Heri desu,Not worth paying for the subscription!!
2020-02-25 11:38:22,,"I’ve been using the premium version for a while now, and I think overall the app is very convenient and quick. I especially enjoy the extensive food database, since I rarely need to add my own nutritional info for food. I would however like to suggest a few improvements:
- currently you can add directions to meals but not recipes... which doesn’t make a lot of sense imo (unless I’m missing something here)
- for the dashboard, it would be good to have a few more display options, such as to not show calories or to show % remaining of nutrients 
- I wish net carbs was a thing, since it is easy to over consume fibre when on a calorie deficit, and end up having less calories from carbs and then getting less energy for workouts/day to day activities. It’s also easier to plan macros based on net carbs imo.
This will probably never be read but whatever lol",4,False,ohcomeoniseverynicknametaken,Good app but could use a few improvements
2019-07-07 22:59:38,,"Tracking keeps me honest and accountable. Gives me the leverage to walk away from unhelpful food and to make better choices. Quick entry and copy n paste features make tracking easy. At the end of each day, MFP predicts what my weight might be if every day is like today’s. That’s been a powerful motivator for me. Nutritional breakdowns of food are great for telling me what nutrients I need to eat more or less of. All helps my body feel satisfied. Also links with my exercise app, so exercise downloads automatically to MFP, and I can see the impact of that walk/run.
MFP has been a lifeline to me - given me power and control over my food that I’ve been lacking for a long time. No longer feel powerless and defeated. I’m getting brilliant results!",5,False,1DiamondSky,Effective tool for weight loss/healthier eating
2023-11-30 23:45:41,,"I have used via paid subscription for 2 years plus. I have noticed the app is now buggy and often times slow to respond to inputs. It wasn’t always this way. It consistently crashes on iPhone running the latest iOS. The tech advice is always uninstall and reinstall the app but this doesn’t change the behaviour. There are problems with the program that need to be addressed. Other than that it is good for recording meals, calories and tracking your weight. The community is okay but with eating and weight loss groups you will see a range of views from hard science to fad guru following to more esoteric and extreme examples. There are probably other apps that do the same thing and run better than this one. I turned off my paid subscription because the only paid feature I used was the barcode scanner and also because the app’s performance is not what it once was.",3,False,C P. Perry,Very buggy
2021-10-27 15:11:06,"{'id': 25954887, 'body': 'Thank you for providing this feedback. Our sincere apologies for any problems you are having. We believe this issue should now be fixed. If you are still experiencing this problem, can you please follow the link https://myfitnesspal.zendesk.com/hc/en-us/requests/new or send an email to support@myfitnesspal.com for further help?', 'modified': '2021-10-28T20:06:23Z'}","** reminder issue fixed..
took a long time and removed two stars due to the unprofessionalism of the support team that continually closed the ticket and ignored my responses.. This type of service is poor even for a free user, but for a Premium user is 
Incomprehensible and the worst I’ve experienced in any subscription service.

Been a user since before the days that it was bought out by UA. Ever since then it’s gone down hill and being a Premium user just means no ads and some features. Been having an issue for 6 months and support closes my ticket and refuses to address the issue, and when I reopen it’s always the same song (it’s with the Dev Team). Also the database is pretty off for a lot of the foods, and doesn’t seem to be moderated at all. If you can give it a miss I’d suggest you do so or use free as premium support isn’t very premium at all.",3,False,BananamanOne,"Issue has been fixed recently, support still thumbs down"
2024-03-14 01:25:04,"{'id': 42613871, 'body': 'Thank you for taking the time to contact us and providing this feedback. We will definitely share this with our team and we appreciate your help as we continue to improve our program! If we can help with anything else, or if you would like to provide additional feedback/suggestions, please email us directly at support@myfitnesspal.com. Thank you!', 'modified': '2024-03-15T15:43:19Z'}","I am located in Australia

I am using your app, however I am also on a meal plan of 1200 cal per day with lite n easy and I’m noticing that the calories calculated in the app are not amounting to the correct calories that lite n easy has dedicated to the meals, I am wondering if there is a reason why this is? 

I am currently using the free version. I also think it would be beneficial. If you offered students a discount to use this app as it is beneficial for students young people and anyone to be able to make healthy lifestyle changes. However the app is rather expensive for someone who is studying full-time. 

As a nursing student, I would like to use this app in the premium version however, I cannot afford the current cost of the app. 

Overall, the app has been a good experience. I do wish the exercise videos had explanations of what to do and how to do the exercises. I would like to say one day that we can connect our Apple watches to the exercise videos through the app to see how many calories were burning when we screen, share it to our TV. 

I look forward to using this app in the future, and I hope everyone reading this has a great day.

I also think it would be good if the app could send motivational notifications to both the free users and the premium users to help encourage movement and using the app.",3,False,Bell_makeham,Great app but small issues
2022-06-25 02:05:32,"{'id': 30580890, 'body': 'Hello! Our apologies for any problems you are having locating the progress page on the free app. Please reach out to us here https://myfitnesspal.zendesk.com/hc/en-us/requests/new or directly at support@myfitnesspal.com for further help. Thank you.', 'modified': '2022-06-27T14:12:19Z'}","I love using MyFitness Pal to log my food & exercise journey but also to keep track of my weight loss journey. I find the new upgrade has less free features to offer now, including the progress diary which has now become a premium feature. 

All my progress photos and weight history from the last 6 years have been removed so I’m not that excited about the new upgrade. This was a staple feature of the free version for years and now it’s all of a sudden become a premium feature. 

Disappointed to say the least, this was one of the main features that made this app so awesome and versatile to use. I was contemplating to upgrade to premium just recently as I wanted to dive deeper into my macros and analytics but the recent upgrade has changed my tune… not a fan of the new upgrade the free version has literally been stripped back to its bare bones. The only way I’ll be able to retrieve my weight loss data & history from the last six years is to pay a premium for it, not cool.",1,False,Chezza2212,Recent Upgrade 👎🏽👎🏽
2019-06-08 04:17:17,,"The update has ruined this app for me. When the update happened 3 days ago it created hundreds of reminders I can’t get rid of. I was so confused as to why I was get around 50 notifications for each meal, I went into the reminders part of the app and founds dozens of reminders had been set. I went through and turned them all off, went out of it and when I went back into it they had all been turned back on. So I had to go through each reminder one at a time and delete each one individually. Then a couple of hours later I get 50 notifications to log my lunch!!! I go back into the reminders and each one I painstakingly deleted had reappeared!!! I’ve missed text messages and emails because this is clog up my phone notifications and making my phone over whelmed and slow! If I can’t fix it I will have to delete the app",4,False,Lostfaithinhumanity,Terrible update
2024-04-09 08:16:11,"{'id': 43205920, 'body': 'Hi there! Thank you for your review of MyFitnessPal, we are happy to hear you are enjoying the program! Please also see https://myfitnesspal.zendesk.com/hc/articles/360032621751-How-can-I-track-vitamins-medications-or-supplements for more information on logging vitamins and minerals.', 'modified': '2024-04-11T16:44:03Z'}","I’ve been using this app for quite some time now and I have been enjoying what it offers. I have just started dieting again and have paid for premium which allows me to concentrate on daily calories, and adjusting protein, carbs and fat for cutting down. Which means losing fat and keeping my lean muscle. This addition also allows me to set up 1 day a week to have a higher calorie as this is my cheat day. 
I would love it if zinc can be added to the nutrition page as I really would like to know if I’m getting enough of this in my diet. 
I would highly recommend this app if you want to keep control of the calories you have per day",5,False,White Sport Socks,Brilliant App
2018-05-12 02:36:55,,"MyFitnessPal has a huge catalogue of foods available to help keep you tracking and accountable, as well as allowing you to scan the barcodes of your food to help log all nutritional values, not just calories. 
I've used MyFitnessPal for years on and off, never being truly consistent, but I decided a week ago that I needed to lose this 15kg, and by being able to track exactly how many calories I'm consuming, I've been able to drop 2kg already. 
Only annoying thing is that it constantly insists that you upgrade to premium, not just in order to access other features such as macros and intermittent fasting scheduling, but also leaves a banner on every single tab in the app. If I want to go premium, I will - it's annoying that I have to look at that ribbon advertising premium everywhere.",4,False,UserError26,Already lost 2kg
2021-11-09 03:36:07,"{'id': 26195534, 'body': 'Hi there, thanks for trying the program! Please see https://myfitnesspal.zendesk.com/hc/articles/360032270532-Can-I-share-recipes-with-other-users for more information. Please reach out to us here https://myfitnesspal.zendesk.com/hc/en-us/requests/new or directly at support@myfitnesspal.com for further help. Thank you.', 'modified': '2021-11-10T14:38:01Z'}","My nutrition coach asked me to download and use My Fitness Pal so we can set goals and track calories and macros. The goal setting is fine. But for some reason the recipes that my coach has set up in My Fitness Pal are not coming up in the search results, no matter what variation of search terms are used. She has set the recipes as “public” so that is not the issue. I can see hundreds of other (often not relevant) search results so it’s not a problem with my access or connection. This needs to be fixed - so recipes marked as public are searchable by others. Also, it’s very annoying that a recupe can’t be quick added with just calories and macros added, it’s so time consuming to have to put in every single ingredient to get the values. Please fix this also.",3,False,gretoutfg,"Some good functionality, but big thumbs down for the food search"
2022-08-03 01:54:14,"{'id': 31282260, 'body': 'Hello Rama! Thank you for providing this feedback. We will definitely share this with our team and we appreciate your help as we continue to improve our program!', 'modified': '2022-08-04T14:49:50Z'}","Was a good app, now it’s an advertising billboard lol If you enjoy being interrupted with pointless adds then this is for you lol. No longer user friendly and has always had issues reading barcodes especially from Coles. expect to constantly be interrupted with advertisements which makes the overall efficiency of using this app extremely poor. Very little thought has been considered when applying Improvements each update instead the experience is underwhelming at best and more frustration due to this app becoming an advertising tool more than what it was originally intended for. Most organisations use advertisements to support their product/business but you can achieve this with out these adverts disrupting the use and function of the app, an improvement that should be considered for future updates. User Experience should be of priority and addressing the above issues would be a reflection of this.",1,False,Rama tu,Advertisement Sell out.
2021-06-20 23:34:48,"{'id': 23550067, 'body': 'Thank you for contacting us and for using MyFitnessPal - we are truly honored to be a part of you and your clients health and fitness journeys. Our sincere apologies for any inconvenience. We are aware of the issue and hope to have it resolved as soon as possible. Thanks for your patience.', 'modified': '2021-06-23T18:03:35Z'}","I have used MyFitnessPal daily for 12 years. Not just for my own nutrition tracking, but also to track nutrition clients remotely. I’m a paid premium user, as are all my clients.

Tracking clients macros remotely is now excruciatingly clumsy using this app, and I can no longer use this platform for this purpose. Duplicate entries and bogus data is everywhere, and not just on one or two clients, right across the board. Mobile/browser data doesn’t sync properly, and the food database has grown into an abomination of false values. I’ve attempted to resolve some of these issues with support but they don’t seem to care.

This nutrition tracking concept should not be difficult to deliver in simple to use app form. So after a very long time on MFP I’m now looking at alternatives. This is far from optimal.",2,False,Hellochocobo,"Once great, now steadily becoming unusable. Find a better tracker"
2023-02-18 08:47:42,"{'id': 34995066, 'body': 'Thank you for providing this feedback. We will definitely share this with our team and we appreciate your help as we continue to improve our program!', 'modified': '2023-02-21T15:29:47Z'}","If you dont want to pay dont use this app and do t waste time going through sign up.   The payment terms and conditions are only presented after you have provided a lot of personal data and full consent for this data to be used and leocessed in the USA.   Having 'accepted' their privacy consents they then inform you of their pricing policy.   In Australia this is illegal under consumer law as it introduces new T&C's and is a form of drip pricing (and at $30 a month its a rip off- just think you could buy the entire Microsoft 365 suite 3x over for that).   Furthermore, a free 1 month trial is actually not free if it imposes the obligation (condition) to unsubscribe- this is a real cost, rea time and real effort.    This is a waste of time going through the sign up process to be informed of the pricing at the end.   Very disappointed with this cowboy and illegal approach to their marketing sign up process.",1,False,Justin2,Not free.  Waste of time.  Illegal sign up process.
2023-07-10 20:11:59,"{'id': 37635443, 'body': 'We are sorry to hear you were running into issues creating your own workouts/exercises. Please write into our Support Team for further assistance by emailing support@myfitnesspal.com. For a full list of features included in a subscription, please see: https://support.myfitnesspal.com/hc/en-us/articles/360032625951-What-are-the-features-of-MyFitnessPal-Premium-. Thanks!', 'modified': '2023-07-12T14:09:09Z'}","Still No Enough Features so I Cancelled My Subscription, You know what would be a useful feature & I have Suggested it before a few times, You allow us to save meals plus create recipes,You Don’t Allow Us to be able to Save Any of Our Workouts so that we can then load or add these Pre-saved Workouts to Our Daily Training Workouts or Exercise Schedules making it easier and faster than having to enter the information over, then over, over again that continues to waste precious time that we could be spending on doing other things.
.
PLEASE Do this feature so we can save some of the precious that we could be saving from all this continuous re-entering of data again, again and again.",3,False,CAPTAIN WILL SKYLINE,Still No Enough Features so I Cancelled My Subscription
2018-01-25 00:10:10,,"I love this app! I can do everything from just one application - track food, see exercise results, track my progress, and sync my fitness tracker. I’m also getting real value out of the blog: I’ve gotten some great fitness tips, ideas for new exercises, and some new meal plans that are working well. I started using the app just to track food, and it made a big difference to see where my daily calories were actually coming from. I made some simple adjustments to what I was eating and had instant results. I’ve slacked off from my routine a few times, and this app always helps me get back on track. Now I use it for everything :)",5,False,LeighEllen,Everything I need for health & fitness
