date,developerResponse,review,rating,isEdited,userName,title
2019-01-13 23:54:33,,"I've never seen an app use more push notifications than this one - every single day pestering me to weigh myself (which I always do first thing, via another app linked to Apple Health), to log food, etc etc. If I ignore it long enough I even get a passive-aggressive push notification announcing that it won't send me any more ""because they don't seem to be helping"", yet it sends more anyway! Deleting now to solve the issue.",2,False,Ubhal,"Notifications, notifications, notifications"
2024-04-07 11:49:19,"{'id': 43157597, 'body': 'We are sorry to hear you are not enjoying the current experience, but we have passed along this feedback to the appropriate team. If we can help with anything else or want to provide additional suggestions/context, please email us at support@myfitnesspal.com.', 'modified': '2024-04-09T16:12:26Z'}","This app is so painful to use. The UI is horribly design. It’s impractical for the simplest things like logging one item. Still it’s what everyone seems to use for calorie tracking. I can’t believe there is no better alternative. I understand you need to put ads to monetize it, but could you at least make a simple and easy to use UX. The layout, the colours, the buttons placements, it seems design by an amateur.",2,False,Herno ;),Painful to use
2024-02-21 00:52:39,"{'id': 42139793, 'body': 'Thank you for your review of MyFitnessPal, we are happy to hear you are enjoying the program! If you ever need support from our team, please visit: https://myfitnesspal.zendesk.com/hc/en-us or send us an email to support@myfitnesspal.com.', 'modified': '2024-02-22T16:47:06Z'}",I’m so glad to reintroduce this app back into action it has advanced such a lot since last use. My partner has premium and I run the free app now my dietary habits have changed. This app is only as good as the accuracy of information you input.,5,False,ngitbhop,Make it work for you
2023-11-09 22:43:07,"{'id': 40106614, 'body': ""Thank you so much for your 5-star review! We're thrilled to hear that you're enjoying the MyFitnessPal app. If you have any questions or need assistance with anything, please don't hesitate to reach out by emailing support@myfitnesspal.com. Keep up the great work on your fitness journey!"", 'modified': '2023-11-13T16:30:17Z'}",MyFitnessPal is a great way to keep track of my kilojoules and I love the nutrient/macro tracker to check I’m eating the right things. The recipes are great too. It works well with my Apple Fitness app to collate my activity as well. Since using the app I’ve lost 4kg and feeling much better for it.,5,False,Landy396,Great health tracker
2022-09-14 05:19:40,"{'id': 32037062, 'body': 'We are truly sorry for any issues you are having with the app. If you could please visit: https://myfitnesspal.zendesk.com/hc/ or send an email to support@myfitnesspal.com for further help. If need be, you can always access the program via our main site at www.myfitnesspal.com.', 'modified': '2022-09-15T12:00:56Z'}",I have been using the app for years and I think may be there were some update and the app is super slow now. I have close the app and open again every time I want to log my food. It’s annoying,5,False,Anta1191,App is super slow now
2019-04-29 22:23:57,,I am trying to submit an email to say the program is crashing at startup and it keeps sending me around in circles saying it should be fixed now (which it’s not) and won’t submit my email request,5,False,This name can't be taken,App is currently crashing - your support won’t let me email
2022-01-13 04:11:45,"{'id': 27447908, 'body': 'Thanks for the feedback. We will share this with our team to review for future improvements.', 'modified': '2022-01-14T15:30:38Z'}","Please bring the entries layout back to how it was. It looks old fashioned and cluttered, please get rid of those text boxes for serving size ect, they’re painful to see. Colour scheme for macros also looks very sad, needs a splash of colour. The app itself is great but after the latest updates it is very off putting, it lost completely the sleek look it had before and all the fun with this new ‘excel spreadsheet’ vibe.",2,False,biabia84,Terrible interface after update
2018-02-22 21:26:50,,"This is a great product, intuitive, easy to use and extremely useful for watching not just calories but also Carbs and other nutritional information although I have noticed that it doesn’t seem to have data for some of the vitamins.",5,False,Raven-Spotter,My Fitness Pal
2024-05-30 08:36:34,"{'id': 44247210, 'body': ""Thank you so much for your 5-star review. We are always striving to enhance the user experience, so our team is happy to hear you're enjoying the MyFitnessPal app. Thank you!"", 'modified': '2024-05-29T16:35:45Z'}","Simple to use and helps a lot if you want to track calories, macros and other fitness and health goals. It doesn’t connect perfectly with my Garmin watch though, which is not a big deal. Great app!",5,True,Luiza Barb.,Simple and help the track of calories
2022-05-04 12:38:11,"{'id': 29578382, 'body': 'Thank you for your review of MyFitnessPal, we are happy to hear you are enjoying the program! If you ever need support from our team, please visit: https://myfitnesspal.zendesk.com/hc/en-us or send us an email to support@myfitnesspal.com.', 'modified': '2022-05-05T16:02:43Z'}","Great app, was a tad complicated for the first day but after a few goes at it it’s actually simple to use. It’s been a eye opener. I haven’t really changed how much I eat just substitute what and when. For example something as simple as changing my yogurt to another brand means I can have the same meal but have the full nutritional benefits. 
Instead of IF with one big meal a day I stagger them to allow time to absorb. 

Will update after weight loss results. But so far thank you. 

Developers:
Would love it if the compare tool was available on the app.",5,False,Krisrtnz,Great app
2024-05-28 06:51:03,"{'id': 44348911, 'body': 'Thank you for taking a minute to share your great suggestion with us! We will definitely consider adding it for a future update.', 'modified': '2024-06-03T18:58:17Z'}","Loving the app. Wish it had more functionality around the management of the meals though i.e being able to bulk delete meals items, seeing the macros of each meal individually and a bit more powerful filters. Apart from that, I find the app so powerful and useful",4,False,Haytuhaitower,Fantastic app for calorie tracking
2024-01-20 08:40:21,"{'id': 41459022, 'body': 'Thank you for providing this feedback on the cost of Premium. We will pass this along to the team to review. As a free user, you can still see macronutrient values of foods by tapping into the food itself, or in the Nutrition page. Please also see this article for more information: https://support.myfitnesspal.com/hc/en-us/articles/15457546881805-What-is-included-in-the-free-version-', 'modified': '2024-01-22T18:40:21Z'}","Been a member since 2016; really good to track macros and scan the food to get accurate information however now all the features are becoming a pay to use app and I think it’s really unfortunate. I will be having to find another app that does this, as this is just too expensive and utterly ridiculous as ive been a member for a long time on and off. Pretty disappointing",2,False,Alex22222uwbcwi,Was good but just pricey now
2023-11-14 22:21:06,"{'id': 40178747, 'body': 'MyFitnessPal believes food should nourish and be enjoyed, however, we acknowledge that relationships with food are not always so simple. https://support.myfitnesspal.com/hc/en-us/articles/360032625071-Eating-Disorder-Resources', 'modified': '2023-11-16T17:07:45Z'}",I know it’s not completely the apps fault but I would be really really careful downloading this app please trust me I downloaded this app around 4 months ago and it has lead to me having Bulimia. Instead of calourie counting just eat healthily and cut out sugar foods and drinks and junk. Jsut don’t let it obsess you it got the best of me please don’t do it to yourself it’s so difficult to stop please don’t download,3,False,Ellfisc,Lead to an ed
2022-10-20 22:08:28,"{'id': 32734840, 'body': 'Hi, thanks for reaching out. We’re sorry you’re disappointed about Barcode Scan. You can still quick-log previously scanned foods from your history, and free members have access to log any food by searching our global food database. https://bit.ly/3fYl5vj', 'modified': '2022-10-23T18:38:15Z'}","When it dawned on the devs that barcodes are something everyone wants to use as they have for years, they removed them untio you pay the exorbitant membership fee. We aren't against paying for a service, but the amount is silly for a very popular and scalable app. How much money do you guys really need? Always more I guess...

Removing features is obviously a downgrade. 

Will be looking for alternatives for us to continue to maintain our health with!",1,False,old mate from Canberra,Features being removed to push premium
2024-03-13 08:57:07,"{'id': 42593084, 'body': 'Thank you for taking the time to contact us. At this time, there is not a specific area designated only for Restaurants within the main database. However, we should have many items from various restaurants already contributed in the database.', 'modified': '2024-03-14T18:01:00Z'}","Imagine if I could enter the eating plan I'm on instead of searching for an item by name and getting every world entry. In Australia I could tick ""lite and easy"" and a tab could have just its menu. Or weight watchers etc All verified and updated by those suppliers.",5,False,Am I lost ?,Love it...but
2018-12-02 13:31:01,,I have previously logged into My Fitness Pal (via Facebook) and have been a user for many years. Recently tried to log in again after a month of inactivity. I was prompted to either log in via email or Facebook. Selected the Facebook option and was redirected to the sign up page... is there a bug in the program or something I’m missing..? I cannot log into the app.,2,False,Ballerina body,The “log in with Facebook” button does not work
2018-01-09 09:42:13,,"Recommended this by someone who has lost weight with it.  However, haven’t signed up and have put generic details age, weight, etc. and email for info.  However, getting emails from Brendass via My fitness pal asking me to click on a link to view hot new videos.   If it sounds trashy I’m not going to click on it. That is usually how malicious emails are spread. Not happy that it has come through my personal emails as well as the app. Might be deleting it now.",2,False,Pixelchicky,Indifferent
2024-02-14 23:33:50,"{'id': 41908222, 'body': 'Thank you for your review of MyFitnessPal! We are grateful for your kind words, and pleased to know that the app has helped you along in your health and fitness journey. Keep up the excellent work!', 'modified': '2024-02-12T21:37:55Z'}","It doesn’t matter how much exercise you do, you won’t loss or maintain weight consistently if you don’t track the nutrition and the amount you eat against your nutrition targets. My Fitness Pal is your best friend to achieve your fitness goals.",5,True,virtualmiguel1,Not tracking = No Goals
2023-06-19 06:57:11,"{'id': 37237511, 'body': 'Hi Ivan, we are thrilled to hear that the MyFitnessPal app is helping you reach your goals! Keep up the excellent work!', 'modified': '2023-06-20T21:07:23Z'}",Since using the app I have been able to control my calorie intake down to a fine tee. I use the recipes which are given and lost 55kg in the past year. I highly recommend using the app to gain control and success in your life.,5,False,Sexy Ivan.,Ivan’s review
2023-01-03 22:21:00,,I got this ap to track my eating. The food selection process is really easy with the barcode scan and meal scan tool. It has also really helped me understand the nutritional value of food.,5,False,ScumAmy,Easy to log food
2022-10-06 22:18:10,"{'id': 32467329, 'body': 'We are thrilled to hear you have been having success with the MyFitnessPal app. Thank you so much for sharing your feedback. We wish you a lifetime of health and happiness!', 'modified': '2022-10-09T13:33:08Z'}",The MyFitnessPal App has been instrumental in me loosing 20kgs over the past 18mths. Being able to quantify what I’m eating has made the weight loss journey significantly easier. Couldn’t have made the progress I have to date without the app. 5kgs to go.,5,False,NoosaTri,Fantastic
2022-08-04 01:49:18,"{'id': 31347101, 'body': 'We are truly sorry for any issues you are having with the app. If you could please visit: https://myfitnesspal.zendesk.com/hc/ or send an email to support@myfitnesspal.com for further help. If need be, you can always access the program via our main site at www.myfitnesspal.com.', 'modified': '2022-08-08T18:56:02Z'}","I’ve had the premium subscription for several years now, I was charged in July for the next 12 months, today the app has removed all my premium options and is asking me to reactivate even though I’ve already paid and no one is able to help me with this issue. Apple has confirmed the payment and that my subscription is active!",2,False,premium help,Charged for premium and not upgraded
2021-02-15 13:06:44,,"Genuinely love this app so much
I use this every day to track my calories and couldn’t be happier. Is so good that you can still do so much without purchasing a premium, as I already subscribe to so many different things and I wouldn’t be able afford another 

Thanks so much guys :)",5,False,kankaks,Greatest app ever
2021-09-30 10:32:37,"{'id': 25445893, 'body': 'Our apologies for any problems you are having. Please reach out to us here https://myfitnesspal.zendesk.com/hc/en-us/requests/new or directly at support@myfitnesspal.com for further help. Thank you!', 'modified': '2021-10-01T18:47:07Z'}","I have used this app for many many years and always found it good, the latest update where it forces you back from the diary screen to the Home Screen full of ads and “blog posts” between every item entered is rubbish. I don’t know if this is a glitch or intentional to try and make you pay for premium to get rid of ads. If it’s the latter I will be deleting this app very soon.",2,False,Jaybee132457,Latest update is rubbish
2021-02-08 10:24:20,,"My favourite app too count my macros on! 
Possible improvements:
Be able to choose favourite brands when looking up foods example , all Coles versions of those foods come up first etc.
PLEASE add widgets!! I would love to be able to see an overview of my macros and calories!! The same look as on the Apple Watch",5,False,Jturn247,Favourite !!!
2020-10-16 08:38:24,"{'id': 18538914, 'body': 'Our apologies for any problems you are having. For additional support please visit: https://myfitnesspal.zendesk.com/hc/en-us/requests/new or send us an email to support@myfitnesspal.com.', 'modified': '2020-10-17T15:15:16Z'}",Removed the iMessage send meal to people feature. Very dissatisfied. So everyone with the app in the house has to input everything individually. This app went from great to very average and not user friendly.,5,False,AB-222,Removed useful features in last update.
2017-12-12 05:46:21,,"In January 2017 I decided to lose weight
Without this app I could never have achieved my goal 11 months later having lost 13 kg
Buying new clothes was my Oscar moment and the only person to thank was you
I have recommended this app to many people all of whom are delighted",5,False,Hoza Lapa,Great app to lose weight
2020-05-14 11:06:54,,I have just upgraded to premium and want access the plans but they won’t load. It comes up with “Data couldn’t be read as it isn’t in the correct format” . This is highlighted as a new feature why doesn’t it work. None of the plans work all have the same alert.,4,False,Scot4,The plans don’t load
2018-12-28 13:21:44,,"Been using this app for a long time, however it no longer tracks your steps against calories burned nor does it have many Australian products in it!
I have contacted you several times to get the glitches fixed but no response!!!
It deletes my history and steps after each day and doesn’t calculate exercise calories properly!!!! 
Shane, because I used to love the app back in the day and hoped all these things would get fixed!!! Does anyone even work there?",1,False,The Dealer!,Hello? Do you ever respond to customer emails???
2024-05-28 00:04:36,"{'id': 44247244, 'body': ""Thank you so much for your 5-star review. We are always striving to enhance the user experience, so our team is happy to hear you're enjoying the MyFitnessPal app. Thank you!"", 'modified': '2024-05-29T16:36:23Z'}",I am throughly enjoying my 16/8 fasting Entering the food into the diary is very easy It is great to be able to plan my meals and snacks . Thank you for making this Ap so good to use. My trial month was excellent. Now the next 12mths will work well. My weight is coming off easily.,5,False,Holidays 2023,My fitness journey
2024-09-20 04:36:38,,"Very simple to navigate app, helped me track my calories several times better. Also tons of options for the food selection.",5,False,i gave roblox money,"Easy to use, many features"
2019-05-02 10:28:24,,"Was told by my doctor to use this to help with controlling calorie intake for a diabetic diet. Gave up as every time I went to log a meal all I had to choose from was American choices! 

I downloaded and paid for this in the Australian App Store, set it up stating I was in Australia so you would think the developers would have had some way to make it Australian for this market but no everything is American.

I do not wish to spend hours trying to find something close to what I am making for each meal so I can log it, that’s not the idea or point of these things.

NEWSFLASH - WE DO NOT ALL LIVE IN AMERICA 

If you sell an app in the AUSTRALIAN App Store then do your due diligence and make it semi Australian.

Guess I will have to find something more local, and let my Doctor know to stop recommending this app! Way to go idiots.",1,False,Jzgxkh,Can I give this a zero
2019-04-29 22:40:29,,"Before when I used the search bar to add items it would always work, but after updating the app I can’t seem to find anything anymore which is frustrating.
No one has the time to google the content the food has and to add every single thing they eat themselves.
Please fix this :( it was such a great app",3,False,meowiemeows,"Can no longer add a food, search bar useless"
2018-10-12 15:42:28,,"This really is an amazing app and has insane potential. It really has helped me lose a lot of weight and track my macros. 
But you can only use the app for a matter of seconds before it crashes and you have to start all over again. The only reason that I put up with it and even pay for a membership is because the app is just that good.",3,False,ToaDy_,Almost unusable
2017-10-04 11:57:51,,"Disappointed in MFP’s misleading conduct with their 3 month trial of premium service. I was able to sign up for it in a few clicks, was at work and didn’t read the pages. I forgot to cancel the subscription at the end of the month and was automatically charge $80 for a 12 month subscription. I emailed MFP saying I felt duped into this and did not want the premium service and was got generic and useless response. Not happy, feel very deceived and short $80 and the premium service is not worth a cent of it.",1,False,Randyrandle,Dishonest free month trial cost $80
2024-08-16 08:39:39,"{'id': 46106668, 'body': 'We are sorry to hear you are not enjoying the current experience, but we have passed along this feedback to the appropriate team. If we can help with anything else or want to provide additional suggestions/context, please email us at support@myfitnesspal.com.', 'modified': '2024-08-19T18:59:15Z'}","It’s okay I guess if one subscribes to remove those pesky ads
The names of items are often inaccurate 
There is no system in place to add clear names for products
They are often hard to find
And it’s not easy to update the calories when it has been entered incorrectly or provide feedback on this - not on the list of options 
I don’t like that it opens in the generic dashboard 
I am in here to enter food so that extra step three times a day is frustrating
Too busy and a lot going on on the interface
Updating my weight is annoying as I have to go into 6 levels to update it - it should be easier",3,False,LuluLeicester,Feedback
2023-08-15 02:12:06,"{'id': 38345423, 'body': 'Our apologies for any problems you are having with your Premium subscription. For additional support please send an email directly to support@myfitnesspal.com. Thank you!', 'modified': '2023-08-17T09:15:56Z'}","I have been a long time user of My Fitness pal. Loved it. So I went premium and it was excellent. Then one day a few months ago it stopped working. I can access as per normal but no premium functions. I’ve tried to contact My Fitness Pal many times with no reply. I have full access until June 2024, but have no premium membership functionality. 
My Fitness Pal, please contact me to sort this out? I was once a very happy customer.",1,False,tonyt9999,Premium member with no premium functions
2020-02-20 09:04:25,,"Love the app, especially the recipes section.
However, it should let you add recipe steps (even if it’s not an online recipe) so that when you’re making a meal, you don’t need to have you recipe book, plus the app; you can just have it all in one place",5,False,melanieregx,"Love, however"
2024-09-14 13:37:47,"{'id': 46773114, 'body': 'Our apologies for any problems you are having. For additional support please visit: https://myfitnesspal.zendesk.com/hc/en-us/requests/new or send an email to support@myfitnesspal.com.', 'modified': '2024-09-16T19:52:18Z'}","I have premium and it randomly logs me out all the time and resets all of my macros. Then the app keeps crashing over and over again and won’t let me log back in. 

The app is also formatted really bad on ipad and only lets you track numbers for any food up to 200 grams maximum, whereas the phone is unlimited. 

Besides that it’s a great app and I use it every day. I just hope they get these issues fixed soon, then it will be a 5 star for me.",1,False,TechmechPlays,Bugs Galore But a Great App
2022-06-29 07:01:38,"{'id': 30641009, 'body': 'Thank you for your inquiry, please contact https://myfitnesspal.zendesk.com/hc/en-us for additional support.', 'modified': '2022-06-30T11:47:01Z'}","The price is just too high per month for what it is. There should be a tiered subscription system rather than just one size fits all, as a lot of us won’t use all of the premium features.

 A bit disappointing, there is a lack in value of buying premium at its current price. $10 a month is more than a reasonable price for what you get with premium, not $30….",2,False,aaronastol,Too expensive
2019-05-29 11:38:27,,"App should go straight to your diary when you open it. Calorie intake should be an option you set yourself. Not based on parameters you set. Should be able to enter numbers yourself for it 

Food should be able to manually enter weight etc yourself",5,False,jdv997,Review
2018-05-20 19:32:49,,"I love this app! I am able to track everything I need to lose weight and eat nutritionally. Most foods are included but if not, you can add them in to ensure accurate tracking of nutrients and calories. It also interfaces to many other apps like FitBit and Nokia scales.",5,False,Chrissy Pink,Sensational app for weight loss
2020-02-24 21:05:34,"{'id': 13701023, 'body': 'We are truly sorry for any issues you are having with the app. If you could please visit: https://myfitnesspal.zendesk.com/hc/en-us or send us an email to support@myfitnesspal.com for further help. If need be, you can always access the program via our main site at www.myfitnesspal.com.', 'modified': '2020-02-25T21:55:35Z'}","I’ve been trying to download the app for a year and, its probably on my end, I cant sign up. i continues to come up with ‘we are unable to process this sign up at this time’ dont know what to do.",5,False,The piederman,I dont understand whats wrong
2022-06-12 06:32:09,"{'id': 30373071, 'body': ""Sorry to hear you're not enjoying the new update. After you have some time with the dashboard, we'd love to hear more detailed feedback to share with the team. Please reach out to us here https://myfitnesspal.zendesk.com/hc/en-us/requests/new or directly at support@myfitnesspal.com."", 'modified': '2022-06-15T12:25:49Z'}","It’s really frustrating to use this app after the recent update which brought a user-interface overhaul. For some reason, MyFitnessPal no longer automatically syncs exercise performed when tracked by an Apple Watch, so it’s tricker to track how much energy has been expended versus how much has been consumed through diet. When a tracking app cannot to do its most basic function, it’s time to move on.",1,False,R34_102,Updates remove user friendliness and usability
2021-01-21 01:39:44,"{'id': 20581942, 'body': 'Thank you for providing this feedback. We will definitely share this with our team and we appreciate your help as we continue to improve our program!', 'modified': '2021-01-22T15:18:35Z'}","A good app. But a recent update introduced a scroll-jacking feature that makes you miss-tap items and slows down the experience. 

They’re hiding (sliding) the search bar tabs upwards when you scroll down through your list of recent meals, but it ends up parallaxing the viewport at a speed the user can’t predict.

The feature might work better if it snapped in place instead of animating. it feels really unnatural.",2,False,@miclgael,New update comes with a bad UX tweak
